authorID,name,biography,birthdate,nationality
1.0,  Ian Henderson  ," Some two I consider. Cold part school television. Success skill owner common.
Foot tell them spring difference full. Real organization modern size. Pick kind interest rest detail carry. ", 1984-03-22 , Unknown 
2.0,Jason Gibson," Drive design choose evening have serve. True region wall newspaper important go feeling.
Happy note recent maintain old school improve. Quite old meeting same skill. ",1946-03-01, Tokelau 
3.0,,Apply property least place. Probably beat almost never draw. Bad thought side tough commercial serve focus.,,Papua New Guinea
4.0,  Travis Wilson  ," Scene particular find ok face rock. Impact necessary front across. Leave claim need firm American.
Control daughter method but personal film about glass. Task bad because degree movement lawyer. ", 1952-03-17 , Ecuador 
5.0,   Kristen Lee   ,"Wind voice serve. Miss feel must energy. Shoulder beyond former Mrs himself return.
Page city rock hold. Player your will black. Range future next old music attention.",1972-06-09,
6.0, Suzanne Gonzales ," Employee keep prevent and report source type. Be natural wrong heart gas region lawyer. His under modern nor might world.
Wear recently happy church. Page meeting last. ", 1995-04-26 , Pakistan 
7.0, Mike Carroll ," Car long that.
Defense live start item. Almost trial letter also nice administration field. Lead this interest candidate. Happen adult foot trip book Mrs population. ", 1946-10-03 ,
8.0,  Erica Marks  ," Provide pay still white war. Foreign sort stay vote industry.
Security fire purpose center young father. Could hospital responsibility painting central remain hot. ", 1980-04-16 , Tonga 
9.0, Nicole Daniel ,"Cultural nor best away soldier start glass. Sport put two include own. Wonder alone message national none.
Camera pick question through country. Event image ready identify face.",1964-12-30,Heard Island and McDonald Islands
10.0,Stephen Jackson,"Interview national section process treat answer child. Bill election pull mean right everybody.
Line involve just use ever believe way affect. Exactly big treat each middle same.", 1944-12-16 ,Cameroon
11.0, Megan Green ,"Our treatment never technology good million. Benefit citizen myself music decide argue yeah about. Article between lose gas population challenge floor.
Out prove state Democrat. Easy my role PM.", 1975-06-18 ,
12.0,," Deal work or success practice who learn.
Toward among air window eye. Seven themselves shoulder. Owner another short yet all finish step. ", 1990-02-26 ,
13.0,  Duane Washington  ,"He happy player lay board. Way agent five word successful serve no different.
Employee test affect sister indicate act. Church leader community. Sort news similar voice.", 1970-06-02 ,Nicaragua
14.0,  Heather Jackson  , Long some least political risk. Into trial issue which while pretty space third. Small available sign particular receive consumer condition. , 1962-09-08 ,Croatia
,  Johnny Woods DDS  ,Continue impact standard because rather experience mind. Picture cut treat recognize more lay win. Size career message send seat radio head.,,
16.0,Taylor Cabrera," Though tough hope our team technology both garden. Feeling he attack small put allow teach.
And season strong party trade it. Dream young audience check. Put involve we weight traditional sense. ",,Anguilla
17.0,  Julie Baldwin  , Within center north throughout character owner Democrat cover. Politics fly pass magazine chair edge they. Sister consumer black attention. , 1968-04-18 , Christmas Island 
18.0, Diana Martin ,Stock safe themselves ask you pretty peace. Born stop others. Win billion tonight.,1975-11-18, Qatar 
,," Vote audience heart product stock. Piece onto beautiful necessary detail us anyone mean.
Debate skin kind attack read event. Easy we they church really nor.
Visit moment various indeed sport blue. ", 1975-04-30 ,Bermuda
20.0, Kimberly Richards ,"Five side important. Own hospital security item buy performance read feeling.
Attack expect Mrs account. Keep star cultural final question. Kind task decision amount firm drive stop.", 1948-07-31 ,Unknown
21.0,   Henry Blackburn   ,Article issue field final success next see. Building beautiful us voice religious. Mother score budget vote reach.,1969-11-20, United States Virgin Islands 
22.0,  Thomas Taylor  ," Its develop result meet. Tonight specific trade reason there her manage.
Blue will low above window performance. Surface not something phone from huge. ",1974-07-11,Unknown
23.0,Molly Ray,"Heart or near lawyer. Sell own experience gun PM adult use.
Turn interesting court entire. Skill issue gas someone choose work view finish.",, Sri Lanka 
24.0, Sarah Greene ," Space high statement my.
Project arm table indicate wish writer.
Effort ten mouth total from. Morning try buy reach store.
Loss attention plan piece a specific. ",1975-03-12, Marshall Islands 
25.0, Adam Castillo ," Often speak movement each well woman. Director eight note the agreement art let carry.
Administration report chair. Any above imagine nearly stock enough. College however note. ", 1983-03-11 ,Belarus
,   James Gregory   ," Mr development beyond over billion media raise. Often religious require word apply.
Adult inside during meet goal. Behind while government a little her. ",1944-10-13,
27.0,  Aaron Price  , Environmental imagine develop seat event development. Increase sort behind public election cost remain. Campaign notice interesting reflect put coach. ,1952-09-23,Unknown
28.0, Teresa Hoffman , Pick pattern offer doctor. Color nor fact song range house apply north. Try expert product foreign. , 1986-11-02 ,Honduras
29.0, Kimberly Smith ,"Hand accept himself sort American. Determine take off player minute guess daughter.
Week lay computer apply. Thing know plan think. Citizen even understand institution light computer election.", 1992-03-13 , British Indian Ocean Territory (Chagos Archipelago) 
30.0,  Edwin Turner  ,Wife how be Mrs last add include. Member rich do really apply interview ago. Fine along perhaps address.,1973-05-03,
31.0,  Ronald Padilla  ," Social attorney election forward. Wrong sort that. Herself right room back color financial nice season.
Move mind star represent long. ",1950-11-30,Dominican Republic
32.0, David Manning ,"When pressure nearly phone. Experience lawyer voice realize result big walk upon. Minute a attack high.
Participant create party wall something item partner. Owner then include have.",1989-05-06, Belize 
33.0,   Melissa Martinez   ,Partner method another fast. Trip off important business hold wall say. Professional answer hospital family audience account leave tonight.,1967-09-05,Pakistan
34.0,  Joshua Berry  ," Can sell catch create. Place happen return bag.
Partner same decide high into pretty whatever. Movement evidence close walk actually wide. ", 1974-01-07 , Nicaragua 
35.0, Melissa Green ," Section write current south personal. Box until series rise.
Class knowledge majority change Mrs. ",1996-09-02, Papua New Guinea 
36.0,  Rebecca Hart  ,, 1982-06-05 ,
37.0,,Win teach piece computer. Education control doctor skill east look author economic. Something become party young., 1979-01-08 ,
38.0,,Operation east short television soon example. Like add better child require grow strong. Any say focus guy more will., 1962-10-19 , Togo 
39.0, Nicholas Espinoza ," Lose really big bill seat teacher society everything. Fund surface provide price book. Ahead interesting computer nearly expect huge.
Record wonder drug. Side would above only recent safe side. ",, Taiwan 
40.0,   Brett Petty   ," Few push he central kind choose. Best serious trial town public ok government.
Although sit affect to. Member will the talk break black include.
Woman system enough with PM. ",1979-01-13, Pakistan 
41.0,  William Harrell  ," Woman week late decision. If build us maintain.
Marriage fly shoulder research lot. Agent agency study by because commercial.
Hope over sound reach wear small. Occur response campaign so wide. ", 1953-03-26 ,Bahrain
42.0, Linda Manning ,"Middle movie present summer follow money the. Public day arrive until.
Then serious store enter appear figure. Wall these involve.
Factor pattern beautiful news good within. Mention bring which hair.",1966-11-03,Yemen
43.0,  Kristina Chavez  ,Far south happy field education plant agree. Develop name behind security show how. Police store million inside ball relationship.,1958-04-17, Kazakhstan 
44.0,,"Conference federal both. Stay partner alone although act stay.
Somebody price movie southern director. Culture information fight. Recognize face manager candidate fund remain away.",1948-11-10, Tonga 
,Robert Norman,"Hot option issue memory window stop.
Box pretty debate physical PM generation adult. Player fine visit reach everyone security current.
Son election society. Make so ball conference.",1984-05-24,
46.0, Charles Keller ," Difficult yourself share himself parent. At reason so glass however major beyond difference.
Modern stock local which fight gas writer. Thus authority me car practice. ", 1992-10-10 , Unknown 
47.0, Daniel Flowers ," And itself me stage. Skill sport tough have. Fire first might person.
Poor firm rather economic. Rich suggest bank consumer color. Score responsibility conference put. ",,Western Sahara
48.0, Melissa Williams ," Who enjoy officer heavy drive after certain. Easy yes truth just decide.
Son chance past. Place available able lay. ",1982-02-08,Benin
49.0, Katherine Adams ,"Minute style television image education.
Just however support spring various.
Artist own under chair start necessary. Think three real develop myself.",1946-03-09, Saudi Arabia 
50.0,  Shannon Bradley  ,National occur let necessary later. Smile energy attention series purpose evidence. Back American wonder teach church lead deep people., 1994-04-27 ,Netherlands
51.0,," Sell religious sure land go.
Here level let either whole voice sort. Move over minute by top low policy. ",1972-03-23,
52.0, Dustin Miller DVM ,"Nice myself attorney run moment they.
Other card physical present rest prepare.
Spring usually development loss Democrat. Bed information first they.",,Egypt
53.0,  Timothy Brown  ,Apply every while before. Fall card true bit finally test too. Over long job executive single war room. Film health hope expect.,1987-11-01,Ireland
54.0, Brian Scott ,,, Taiwan 
55.0,  Victor Baker  ,,, Gibraltar 
56.0,   Danielle Day   ," Rule next least wish. Star buy far nor. Bed people research evening.
Cup yourself goal painting many choose.
Provide network car such you. West process nor back. ", 1988-01-07 , Anguilla 
57.0,   Susan Roth   ,"Down season military media interview or responsibility. Wonder environment cultural fly for.
Wide standard wear sister car hair general court. Eye hear baby say various manage mind.", 1946-02-07 , Bulgaria 
58.0, Karen Tucker ,"Appear live positive discover. Many human still leave.
Your himself she see his various.
Admit use region own reason. Half arm food area.",1977-01-20, Northern Mariana Islands 
59.0, Rodney Carter ,, 1953-06-09 , Ireland 
60.0,  Amber Stone  ,"Call very almost spring. The could society key ball for. Market still sound wife agent seek section.
Environmental knowledge live among. Vote treat sister recently new where.", 1983-11-28 ,Sudan
61.0,Tracey Delgado,Necessary should measure agent improve. Threat either allow drive. Wonder value miss board sometimes organization., 1946-09-24 , Tonga 
62.0, Jacob Smith ," Lay main movie turn. Need road high similar especially. Deep less less poor protect admit.
Along table drive. Wait choice language place question. ", 1971-05-01 ,Macao
63.0,Robert Young,"Real clear officer sure establish speak.
Once speech meet fall claim. Hospital collection give create arrive rate step.",1961-01-30,Unknown
64.0,,"All together reduce brother modern some right. Recent that book provide ready appear.
Who team head after win.
Those care stay. Figure side artist give citizen himself ready.", 1963-03-25 ,
65.0, James Graves ,"Anything floor among one look reflect argue. These action toward play building condition certainly.
Song well since executive. Rate boy thought agree quality particular couple.",1978-02-20,Liechtenstein
66.0,," Around toward long commercial thing similar again. Cup teacher deep southern space few. Somebody executive name.
Page sound change. Another Mrs game participant within sell admit. ",1979-12-14,Anguilla
67.0,   Douglas Barton   ," Community anything send four. Individual prevent nice. Movement yes seek end top.
Computer theory among near state. Agency party guess and training. Purpose all whether again always. ",1975-04-29, Belgium 
68.0, Laurie Guerrero ," Interest chance sense population. Stuff into outside benefit. Message series mother wide ago officer.
Nearly table note fear everything story hear. Budget green successful pretty follow. ",1954-05-25,Cocos (Keeling) Islands
69.0, Jacqueline Rivera ,Whom attack life accept. See technology part civil. Public anything finish win understand government.,1987-08-28,
70.0,  Cindy Dickerson  ,,1984-11-09,Mali
71.0,   David Hernandez   ,"Better newspaper election measure continue kid foreign.
Physical future no sense agree social show. Drug green relationship organization.",1989-06-23, Jamaica 
72.0,  Joseph Smith  ," Edge former change but sell later yet. Station then art religious result know. Produce small manage benefit tell accept way member.
Occur because real particularly voice. ", 1950-08-12 ,Congo
73.0, Gary Sanders ," Animal sell space meet skill he. Wear site too. Situation body ahead as avoid beyond.
Involve open let first see relationship. Last report wife. ", 1966-04-03 ,Mauritius
74.0, Frank Miller ," Green recently race collection gun sit. Next get position last. He husband between energy help reflect move.
Mother significant feeling fast site appear. ",1977-03-23,
75.0,  Carolyn Salazar  , Include item author human accept consumer its necessary. Loss option itself decade specific even. Brother reflect find about trouble. , 1966-03-04 , Micronesia 
76.0,Brian Vargas," Type focus wall.
Chance adult experience paper so my take. Player yourself official same foreign risk officer. Become product west hot group. ",1988-02-18, Trinidad and Tobago 
77.0, Kathryn Garcia MD ,, 1974-08-14 ,Bermuda
78.0,  Diana Nelson  ,Century score important leave commercial woman decision doctor. Market show door house anyone quite. Account other lot increase when create ready.,1966-02-01,
,  Daniel Smith  ,Per wish commercial town movement author employee threat. Deal pattern debate painting phone medical police. Nice second from space fund key news., 1975-02-08 ,Guernsey
80.0,,,1955-08-23,Syrian Arab Republic
81.0,,Easy story push continue nothing leg. Eat for future bad church animal. Its position us member several month now. Want grow so term.,1963-07-10, Sierra Leone 
82.0,Michael Lopez,"Or lay film candidate arrive collection. Face term smile along yes last after.
Marriage when finally while. Team floor raise address.",1971-03-18,Liberia
83.0,   Abigail Gibson   ," Environment also moment. West onto apply most not PM. Include building I choice quickly keep smile. Either audience cover purpose type.
Catch he I. Point tree better one. ", 1986-01-13 ,Uganda
84.0,,"Party top course rise evening get.
Movie for less food public several begin. Left section return power.
From affect force. New term stage sister nature candidate thus.",1989-06-26,Niger
85.0, Shari Smith , Nice once whom them care feel ago. Lot local team car. Republican knowledge brother ahead. ,1996-09-21,Oman
86.0,  Zachary Willis  ," A off here way possible focus.
Media court look toward black oil. House show year different before rule capital. Exactly doctor center take. Truth offer democratic whole present support artist. ",1998-05-07,Central African Republic
87.0, Phillip Taylor ,"Sport attack kitchen voice. Arrive chair PM provide professor measure thing.
Remember manager voice same city section box. Air perform drug instead. Main herself opportunity understand plan.", 1961-10-13 ,Andorra
88.0, Melissa Burgess ,Senior expert space skill conference. Tell she during game than live. Late practice as drug.,1991-10-18,Montenegro
,   Daniel Whitaker   ,Live necessary that because. Two yet economic future quickly life husband., 1989-11-15 , Equatorial Guinea 
90.0,," Star fine sort. Mother general network bar ago structure.
Table pass support until film save if. Its free Republican. Fly attorney establish dog will modern. ", 1959-10-17 , Mauritius 
91.0,  Jonathan Johnson  ,,1961-11-02, Unknown 
92.0,William Wright,"Feeling much response speech relationship course us. Data grow bag newspaper happen.
Knowledge step hard general purpose. Perhaps become behind into health natural cell.",1988-10-10,
93.0,  Felicia Hunter  ,"Recent prepare begin red tax the eight. Bit adult large at expert always.
Option those surface another. Me everything hospital realize. Eat red notice money.", 1954-05-03 ,Vanuatu
94.0,  Jimmy Jones  ,Yourself worker start knowledge. When person must whose. Watch ahead decade serve.,,Grenada
,Tammy Marshall," Social news especially arrive together car public throughout. Return board special south mind director.
Field service teach everyone fear treat. Kind here central adult. ",1986-08-19, Bhutan 
96.0, Tara Pierce ,"Line significant sell fly campaign owner. Happen ok business difference voice before large. Must board like forget ready machine individual.
Stage share final late wide go film.", 1967-02-03 ,
97.0, Sharon Hughes ,, 1964-10-29 ,Central African Republic
98.0,   Gina White   ,"Low fast tonight soldier. Cost discover within production official add.
Lead knowledge term threat likely dog. Money recently about.
Here music instead approach keep return reduce.",1950-09-22, Mali 
99.0,   Robert Hunt   ,"Camera my sport seem wife. Talk drug economy college. Try once table policy walk boy include.
Believe newspaper book next girl. Now at only be though.", 1955-09-08 ,
100.0,  Linda Ray  ,Mission create teach special involve cell science. President degree third table idea require art. Stage to citizen create of black picture issue., 1943-12-17 ,Bulgaria
101.0,  Christopher Harris  ,Population cold though strong team. Fly hard anything health. History lay affect down.,1979-08-06, Uruguay 
102.0,  James Bush  ," Single police politics water ten officer short. Huge rather perhaps level phone list buy. Against Republican he. Hold technology heavy.
Learn tough up major toward manage up. ",1997-02-11,Benin
103.0,Jeffery Krause,,1971-03-24,
104.0,  Fred Sanchez  ,Fast anyone letter decade show successful. Recently health than test strong image everyone., 1968-08-06 ,Monaco
105.0,  Laura Miller  ," Song magazine whole career live eye. Special current science buy development add power. Wife clear enter authority.
Sound well respond do discuss thank foot. ",1995-10-02, French Polynesia 
106.0, Christy Jones ," Nation mouth half free education myself music. However another according teach dog.
So where whom concern piece maybe ball. Example southern card seem. Break notice green pretty sister write wish. ",1993-11-13,Gambia
107.0,   Mary Brewer   , Available throw some once begin reveal forward. Knowledge because occur degree ever special sense environment. ,1998-12-09, Malaysia 
, Nathaniel York ,"But financial which receive factor. Available few cover. Doctor pay read teach.
Sell help south of sea real follow. Game record involve table. Inside book reason whole investment.",1986-03-16, Chile 
109.0,  Taylor Jenkins  ,Argue several or hotel international age. Agent focus simply collection concern public wind evening. Painting serve true risk company.,,
110.0, Todd Hill ,, 1975-11-23 ,Lebanon
111.0,,"What do happen artist difference line. Participant lead agent could.
Move improve reach shoulder relationship affect. Try four single event such pressure second.",1962-10-29,
112.0,   Christine Silva   ," Truth deal class mind who. Prepare glass word blood.
Particular court garden happy really anything strong. Detail day surface effort shake fast.
Citizen story continue point. Ability live they. ",1996-06-07,Portugal
113.0,  Carrie Perez  , Drive if public real its rock service behind. Wrong free international time personal seat again. Which sure my hear at leave we music. , 1959-10-19 ,
114.0, Brittany Williams ,"Determine sell attorney. Mission particular take teach possible deal.
Bring pretty explain civil. Dinner memory kitchen now hot sister. Our husband trade mouth century call.",,Turkmenistan
115.0, Amy Wise ,Natural trial without imagine than bar itself. Administration shake guy and. Once no raise capital kid air., 1952-01-31 , Lao People's Democratic Republic 
,  John Nunez  ,Beyond various or foreign financial. Class decide step. Information different shake learn positive be respond., 1966-02-09 , Guatemala 
117.0,  Brittany Edwards  ,,1972-03-17,Kyrgyz Republic
,  Savannah Becker  ,Reduce popular camera so market level. Happy turn available spring ball human space energy. Morning knowledge seek fact. Nor data stand star see.,1954-06-13, Lao People's Democratic Republic 
119.0, Shawn Holt ,"Group TV raise history pretty. As bank away factor practice skill.
Right account camera hit test music last.",1959-04-07,Guyana
120.0, Stephanie Huynh ," Truth field ok. Agency push green amount school back.
Piece film fill behavior administration new clear. Group program store particular never. Rather early support player probably management. ",1965-07-12,
121.0,  Stephen Wiley  ,"Edge side training middle mind little.
Film movie attack ahead. Teacher arm option court.",,
122.0,,"Sister knowledge on. Agency name offer rich soldier summer security. Fly take garden budget simple.
Fast spring main run. Theory certain yourself prove information.",, Bahrain 
123.0,   Alicia Estrada   ,"Choose miss always concern already difference. Change win along site option. Magazine do official.
Trade have arrive have. Begin to stand able recently treatment.",,British Indian Ocean Territory (Chagos Archipelago)
124.0,,"Heart wonder size necessary support bring. Plan college adult one court either.
Energy her old whom unit reason drop purpose. Develop office rise audience check. Other small ok someone.", 1960-04-05 ,Reunion
125.0, Jose Sanchez ,"Cover crime bit.
Member television store available.
Pick member during somebody tough.
Treatment attention far. Girl security option project.",1989-06-23,
126.0,  Larry Williams  ,"Democrat sign above news sense. Standard chance science society kitchen address.
Throw surface father similar.
South beautiful boy thing eight simple. Guess realize prepare itself everybody.",1995-06-25,
127.0,  Alexander Ruiz  ,East ready happen particularly. Film human visit four. Sort plant speech success.,1954-02-22,Guyana
128.0,  Tiffany Navarro  ," Go eat standard break gas two. Miss staff front official than beautiful enter garden. Color fine page get.
Hand vote system if. Couple day character cold. ", 1967-12-24 ,Burkina Faso
129.0,  Isabel Cox  ,"Change authority talk consumer. See adult change sound produce per.
Its on beat the great. Cultural southern painting fine. Common billion officer head threat section education.",1971-04-13, Antarctica (the territory South of 60 deg S) 
130.0,  Steven Gallagher Jr.  ,Along eye away article degree herself. Card sign morning individual range table property.,1973-05-01,Dominica
131.0, Michelle Williams , Your piece Republican natural race. Term military campaign letter agree item. Blue former popular can clear it never. , 1988-06-22 ,Bermuda
132.0, Heather Bradley ,, 1958-08-12 , Pakistan 
,Christy Spencer, Police spend candidate act. Herself letter short house those artist suffer. Song when expert must while word occur agree. , 1979-10-28 , Unknown 
134.0,,, 1987-05-10 , Uruguay 
,  Sharon Sullivan  ,"Seven sport study how. Mention actually item wait kind hour land.
Fear most compare case work. Yeah sort listen of. Relate star piece eight scene purpose.",1948-09-28, Ecuador 
136.0, Andrew Whitaker ," Reason long respond as star claim. Change democratic improve bit card each president.
Middle agreement study now blue. While weight its late night difficult. Determine whether interest miss. ", 1988-02-23 ,
137.0,," Ago free bit at front full although. Man although particularly former. Push wrong tree not born current cost outside.
Yet if stuff usually campaign myself environment. Now another threat two. ",1983-08-02, Comoros 
,   Amy Baker   ," Activity behind probably message get past space. Effect eye would floor tend also news.
Join event fear often. And place administration network impact special. ",1967-05-06,
139.0, Andrew Lara ,"Whether use ask change cover job door. Matter former give sell off event.
Create science believe issue than military assume. Live clear hand rate peace.", 1982-10-20 , Latvia 
140.0,  Lisa Santos  ,"Glass establish learn represent drive. Help line easy realize magazine whom baby prevent. Rise take goal art successful art.
These research type everybody not catch. Stock buy start operation.", 1955-11-21 ,Sao Tome and Principe
141.0,  Mr. Brandon Gonzalez  ,"System over fact so. Be each garden skill.
Plan expert his evening.
Network southern job book. Player career goal interview.",1947-12-07, Czech Republic 
142.0,Justin Jackson, Name people commercial democratic. Give choice tonight bit last. Shoulder season network that go student. ,1968-08-29, Slovakia (Slovak Republic) 
143.0, Nicholas Campbell , Affect far student ball. Well fall world claim establish expert. Executive boy fast question program site member. Establish important method reflect. ,1949-02-20,Puerto Rico
144.0,  Jessica Jackson  ,Him popular ok performance. Particularly moment offer research forget whole director. Keep network they at., 1959-09-09 , Korea 
