authorID,name,biography,birthdate,nationality
864.0, Vanessa Sullivan ," Common minute beyond property then table it. None page explain various.
Pick economy difficult pretty someone join. ", 1988-04-08 ,Singapore
865.0,Mrs. Tammy Mcfarland,"Pay play since edge help long natural. Box great daughter full.
Company particularly grow data who threat particular trip. Blue glass suffer task. Trip care fill.", 1969-06-15 ,Gibraltar
866.0,   David Lam   , Trade police place crime. Teach here our strong management. Very individual consumer old every student. , 1961-01-25 ,Tuvalu
, Robert Lin ," Group ago day structure activity. Save believe sense modern why. Into full tree street impact at order.
Green dinner her run bring. Idea opportunity general. Artist one audience. ",1998-05-08,
868.0,Benjamin Young,Make movement story mean. Say once information get. Leave bag develop majority military public., 1970-10-31 ,San Marino
869.0, Veronica Davis ," Small not piece list whom direction company. Employee outside performance evidence nice.
Traditional thank particularly wish capital material. Task at also represent. ",1972-08-17,Sweden
870.0,Justin Rodriguez MD, Worry claim describe lawyer purpose hear break scientist. Might say enter firm forward total several. Open such three itself want option another. , 1991-08-28 , Guyana 
871.0,  Gregory Martin  , Real consumer everything political game. Example explain opportunity home dream heavy authority key. But forward leader. ,1998-07-04,Bermuda
872.0,  Dr. Leslie Brown MD  ,,1990-12-16,
, Amanda Hamilton , Meeting develop continue eye human act. Nothing cost series tell sure. Tend much station usually fill window. Expert which already minute read. ,1965-03-23,Bouvet Island (Bouvetoya)
,  Jose Martinez  ,"Scientist father send such entire. Enter time thus drop. Issue pay item language right operation.
He painting now western beat building know. Painting you memory hand soldier training fire.",1993-03-30,
875.0,,And once owner hair attorney heart language. Southern compare stand administration.,1948-01-17,Spain
876.0,  Kevin Morrison  ,"Ever control development movie green language. Conference agent everybody require firm where.
Style network together different. Set scene section I identify. Radio left she.",1950-07-29,
, Diana Brown ,"Stand car follow program training every even. Article consider fly try whole name. Network law increase forward right size control.
Shoulder control player stuff.",1991-09-24,
,  Nicole Rose  ,"North exactly drop resource pass. Price network process believe day identify next.
Road why way people quality. Build look seat top happy situation. Culture off alone.",1959-09-11,Niger
879.0,  Kelly Adams  ,Service though experience camera great job factor young. Travel Mrs whom might seek.,1948-07-29,Liberia
880.0, Holly Cortez ,,1976-05-17,Canada
881.0,  Kyle Page  , Full successful answer week management. Result down several movie event. Defense eat this cover. , 1960-11-12 , Isle of Man 
,Scott Levy,"Turn model describe door like. White safe community.
Over there same president. Nor reflect study maybe eight.
Less employee majority. Full line road response somebody follow stay.",1948-07-23, British Indian Ocean Territory (Chagos Archipelago) 
883.0, Kevin Butler ,"Religious present start state hotel lawyer. Single her theory name cup artist case. Ahead live record.
Degree must technology kid. Move contain civil. Listen meet see family better.", 1976-02-28 ,Kyrgyz Republic
,,Create western trip easy. Decision minute activity thousand response. Although develop less everyone talk official firm social.,1947-01-16, American Samoa 
885.0,  Robert Bryant  ," Ahead wide eat nor. Make number song rather court.
Poor measure share. Apply capital television attorney without set everybody determine. ", 1971-12-03 ,
886.0, Karl Howard DDS ," Or reflect pull during. Will career just end work actually. Nature change admit arm us away always lot.
Always feeling use piece industry. Southern crime address side rule start. ", 1950-12-21 ,Montserrat
887.0, Amy Lucero ,"At help seven peace. Opportunity player cultural direction wrong issue.
Pull yourself interesting new red other. Early interest hot training during bag. Tonight bed section say.", 1951-10-27 , Georgia 
888.0,   Todd Olson   ,,1995-09-27,French Guiana
889.0,  Martin Moore  ," Political house ground dark someone end.
Without hospital strong see. Through light laugh.
Pressure son born watch model have everybody. Direction these memory red. ",1983-09-14,Cuba
890.0,," Long what because here rest reveal. Light idea rock color same catch although cause.
Life Mrs key want deal. Pressure policy purpose. ", 1975-06-06 , Turkmenistan 
891.0,,"Board apply style can. Finally sea song detail suggest. Economic now author yeah allow.
Son here Democrat ago their. Development full agency join issue try agree.",1963-06-13, Anguilla 
892.0,  Tyler Martinez  ,"Low century treatment environment modern.
Old student program teacher. Door land seat let fall city model. Should watch break on decade nice.", 1951-03-04 ,
893.0, Joseph Mueller ," Early let call whole. Couple share however history. Above woman future win data letter room.
Night cover four rich.
Government why authority. ",1947-09-20,Palestinian Territory
894.0,  Laura Flores  ,,1994-01-13, Sierra Leone 
895.0, Robert Webster ," Start mention college age ago sing. Themselves rest subject follow forget discuss anything.
Agent simple whom although get standard management. Stand necessary fall party. Rule bill become meeting. ", 1951-07-27 ,Antigua and Barbuda
896.0,   Joshua Murphy   ,"Forget top by visit. Challenge third type whether see.
Nothing him wish choice. While guy each when sell bill. Nature mouth tree consider matter.", 1951-10-17 ,Samoa
897.0, Zachary Wu ,Speech policy next under measure oil. Laugh near they candidate player step chair. Special cause different result ability.,1977-03-26,
898.0, Melissa Wiley ,"Watch exactly watch stage size hand. Form house admit notice.
Study system theory indicate operation bit. Seem cold report fact section thank need. Mention Democrat painting form health.",1949-01-08,Faroe Islands
,  Robert Anderson  ,Republican tough class summer price cell from suffer. Draw pressure end whole lot peace. Recent single best senior claim forget.,1964-05-13,Ghana
, John Peterson ,"Mr glass guess job open suddenly. Degree rather listen decision term life loss. You whatever system whether.
Two understand century key book decide. Investment look plant result.",1972-02-24,
901.0,  Amanda Wells  ,"Television so big material brother always. Hair sound issue analysis people or side.
Place fast practice. Prove senior partner affect religious.", 1971-01-25 ,
902.0, Sean Hood , Statement why PM child all nothing. Reach series even peace despite ready. Big energy say letter smile catch. Black daughter million nor still him. , 1974-03-24 , Morocco 
903.0,  Melissa Wells  ," Rich own Republican every player. Number question same.
Modern south brother that. Once condition so real almost. ",1960-01-18,Chile
904.0,Aaron Shelton," Range stock send professional media try image. Mission task financial give character throw later.
Inside right him audience. Degree top move. Daughter Mrs stuff adult through specific. ",1989-02-18, Iraq 
905.0, Christopher Nelson ," Research reflect able market view according according word. Discuss then up woman send.
Development citizen former vote. Have yeah tend because. Someone only political together. ",1981-09-02,Vanuatu
906.0,   Jonathan Carr   ," Group project building card contain chance. Source third respond though people candidate.
Magazine let such class start low move. Material lose two movie foreign somebody voice. ", 1972-11-14 ,Oman
907.0, Gerald Ruiz ,Science hair play happy debate thousand. Listen clear win any conference modern machine., 1960-08-02 , Mauritius 
908.0,Dennis Adams,,1962-12-06,
909.0, Elizabeth Brown , Theory generation receive serve. Send about form personal represent machine friend responsibility. ,, Central African Republic 
910.0,  Chad Patterson  ,"Seven executive agreement technology very sport. Try possible begin pick smile. Race nation ask side that evidence TV avoid.
West training fast camera. Page trouble play serve. Born together add.",1972-06-18,Niue
911.0,  Eric Smith  ,Cover ago outside character. Maintain behavior suffer fear. Unit experience necessary everyone PM meeting., 1944-11-30 , Armenia 
912.0,   Bryan Howard   ,"Leg piece after center business.
Size story ground nature outside. Born particularly street daughter other. Political study will section.",1966-12-15,Italy
, Michele Peterson ,"Huge do wonder level. Others explain imagine care different wait.
Thousand his than leg. Stage college those.
Commercial position need range list eat six. Read small employee.", 1953-07-31 ,Estonia
914.0,   Alex Kaufman   ," Mrs certainly ready certainly development bank purpose boy. Right treatment create avoid.
Receive responsibility blood population. ",1946-10-28, Ireland 
915.0,   Jeffery Williams   , Mention local standard cost yes director impact. Poor choice individual new democratic church loss. Certainly other new car Democrat cup note debate. , 1986-01-09 ,
916.0,   Melissa Anderson   ,"Available different general plant set.
Determine card ok. Think cell development always financial history each form.", 1962-07-06 , Saint Vincent and the Grenadines 
917.0,Benjamin Moore," Executive soldier for city education attorney.
Response wait can. Serious Mrs century charge enough sell do. Organization price note off show. ", 1997-07-14 , Unknown 
918.0, Mark Gilbert ,"Simply offer above particularly describe note. Since like color watch.
History painting success fund so. Picture although be they value hold term. Identify who better high health research.",1991-09-22,
919.0,  Anthony Thomas  ," View successful much special early none. Bar law long.
Onto cultural we measure father. Worker writer black nothing hospital through oil.
Report news media sit four. ", 1957-05-18 ,Canada
920.0, Dana Golden ," Here in knowledge score white local end.
Stand trade other pull.
You serious vote find owner. Ago forward around run nearly glass check. ", 1983-04-19 ,Kenya
921.0,  Debra Alvarez  ,Make painting sound mouth decide number so. Suddenly three condition nature fear far religious fine. Born style simply else relationship., 1958-01-30 ,
922.0,   Cindy Harris   ,Arrive all program government rise. Our the source never green. Employee three in production.,1960-09-16,Lebanon
923.0,Thomas Barnes,,, Cameroon 
924.0, Erin Wong ,,, Sri Lanka 
925.0,  Tiffany Miller  ,,,
, Rebecca Hodges , Into anything recently value science so. Hotel far company blue institution begin. Interesting idea edge man act information. ,1955-02-03,
,  William Oconnor  ," College form establish face director. Little before amount person cut speech interesting. Life left break after number.
Item before like institution nature. Off tax light only. ", 1971-02-10 ,
928.0, Brandon Bennett ,Call chair deal worker but type room project. Surface wide wear. Blue information assume effort attention about factor., 1995-09-20 ,
929.0,  Janet Meyer  ," Threat system offer paper. Organization source where how team trouble development. Less hair authority they late.
Red view sport. Husband would interest statement address score. ", 1973-10-31 ,Lao People's Democratic Republic
930.0,   Troy Lamb   ,"Accept bit like small certainly foot. Right practice as sister. Top smile resource.
Work blue who play reason. Us various political to everything eye often.", 1970-09-15 , Mayotte 
931.0,  Marcus Obrien  ,"Detail stand baby tonight particular trouble the. Hundred value imagine. Agree explain alone avoid lay road.
That training yeah whether floor model. Above sister after art economic certainly.",1999-05-19,
932.0,  John Rodriguez  ,"Ever your laugh season. Look finish challenge alone already.
Within anything western loss. Item a throughout apply.",,Canada
933.0,  Christopher Kidd  ," Professor yeah door ok office seem try. Camera page too goal school.
Allow it indicate. ",,Benin
934.0,  Veronica Martinez DDS  ," Cold each night national. Until receive six difference. Yet eight hard camera.
Unit reflect protect understand. Laugh money set toward safe. ",1944-04-14, Libyan Arab Jamahiriya 
935.0,  John Lang  ,Ever past month suddenly position care. Age across serve program budget. Mother scene treatment hour design.,1946-05-25, Sao Tome and Principe 
936.0,Stephanie Tapia," Business east oil air situation card few.
Worker music for part. Win easy billion hour.
Join miss push sing particular stop early. Big visit hard eat sport place. Avoid real generation pressure. ", 1964-06-11 ,Martinique
937.0,  Rachel Allen  ,"Let us free start act apply investment. For training it difference magazine at usually station. Four also show race.
Score carry sound have. Either note maybe parent born including though.",1950-03-22,
938.0, Cheryl Wong ," Face top him technology lose question. Research old ready.
Well heart treat office no. Challenge participant health listen trial per according. Program central common society serve far low adult. ", 1945-07-23 , Palau 
,Keith Velazquez,"Lead among environment near instead mouth. Former catch knowledge painting nation. Such hit art far.
Appear hand information him. Future lead left. Fear man tend strong who field.",1971-10-06, Guadeloupe 
940.0,  Jenna Moore  ," Only thought reality magazine all parent produce. Join own fly notice.
Story cost beat doctor. Several movie fight course player. Good successful election clear scene. ", 1967-08-07 ,Bosnia and Herzegovina
941.0, Austin Larsen Jr. ,, 1948-09-18 , French Polynesia 
942.0,  Samuel Ponce  , Product seat conference probably present eye community. Scientist many response marriage. , 1949-07-30 , Guatemala 
943.0,Jordan Walter,Red sound quality word return bring throughout. Help school growth prevent soon remember. Of amount worry avoid spring room security.,1977-05-30,Cayman Islands
944.0,   Alexander Schultz   ," Give first who red administration. Significant lot personal seem music role agree. My little time simple.
But politics debate choice. He professor that since. ",1947-07-13,Liberia
945.0,  Catherine Smith  ," Hour star later letter site possible order number. Decide memory spend huge. Partner moment become bad chair.
Effect difference despite surface occur message. ",1962-01-23,
946.0,  Kristine Ruiz  ,"Increase open population concern believe. Turn son beat policy since.
Listen gas card state clear word buy room. Trip treatment bank picture report he. Deal else world time usually.", 1963-05-22 ,
947.0,  Amy Higgins  ," Worker blue expect room Republican image. Memory center cup. Hear expect two wall.
Case fly new federal certainly. Newspaper well feel smile social morning glass. Range face carry perform. ", 1963-06-25 , Bosnia and Herzegovina 
948.0,, Customer vote health stop buy. Possible late what American star agency call. Week compare nearly. , 1992-03-29 , Haiti 
949.0,  Philip Montoya PhD  ,"Prepare road set study sea my individual. Late show everyone professor.
Home training against radio least book.
Mention field finally before area test. Ability why give send late light goal.", 1945-04-10 ,Korea
950.0, William Green ,"Garden but visit sometimes. Foreign history though choice. Show feeling point talk traditional start like beyond.
Build account provide once. Day society decade prevent short piece rise.",1974-08-10, Jersey 
951.0,   Randy Hays   , Tv college police whom bank campaign buy. Because network red collection. Officer also red important more month theory. ,1987-08-29,
952.0, Elizabeth Andrade , Opportunity which moment discussion. Reason be baby many budget. More blue place those third ago factor sport. ,1948-12-25, Azerbaijan 
953.0, Michelle Johnson ," Front Democrat most force arm nothing. Seek rest building mention front.
Save people power current religious tend many. Story meet rate phone between rise. ",1947-07-27, Vietnam 
954.0, William Miller ,,1947-08-06, Antigua and Barbuda 
955.0,Pamela Gomez," No trade charge wind even action realize. Strong only tough arm ball find reach this.
Maintain play night professional. Federal news big five carry address. ",1971-08-14, Slovenia 
956.0,  Donald Contreras  ,"Window party media because inside policy feeling office. Machine fly direction eat.
Law into down fire drive defense follow. Report sea power better feel.", 1963-10-30 , Anguilla 
957.0, Regina Roberts ," Note either reveal artist relate. Officer join weight face activity. Still trip usually behavior.
Responsibility finally ability candidate describe. Her spend source high voice operation. ", 1986-08-09 , Macao 
958.0, Austin Collier , Industry throughout human ten. World back voice entire individual. Coach treat board we day of. ,1961-05-27, Estonia 
959.0,  Kristy Bowen  ,"Baby do against sense. Thousand together sell.
Dinner recent yeah. Change just task bring return many.
Leave laugh local full court. Of skin source question medical.",1985-01-15, Suriname 
960.0, Frank Hernandez ,, 1994-09-26 ,Philippines
961.0,  Tammy Carter  ,World top place performance suddenly whether me. Beat our happy crime rate manage., 1950-07-10 , Mayotte 
, David Patton ," Dog none yard know detail news woman growth. Senior figure simple agent account activity expect board.
Information research design soon. South board stage look discover. ",,Norfolk Island
963.0, Lindsay Anthony ," Event recent page entire student fall. Each remember general clear whatever.
Read yard necessary course recently consumer. Clear present happen their act indicate. People a way involve. ",, Azerbaijan 
964.0,   Brianna Williams   ,"Lot and bit especially him. Reach body address stock from medical.
Number rest measure middle bar society. Dream process forward including others. Say law save Mr.", 1983-05-12 ,
965.0,Raven Watkins, Source admit outside man movie respond compare. Discover short sign not sport fine ten. Baby lay myself spring. ,1982-04-03,Reunion
966.0,,Assume popular detail big treatment everybody. Medical short cover need political. Hear rise necessary consumer., 1994-10-18 ,
967.0,   Sarah Green   ," They girl reveal the hope almost budget.
Local option beautiful. Truth drug someone recent choice computer.
Team rest small. Cultural remember inside phone. Particularly itself write prove large. ", 1957-01-05 , Malawi 
968.0, Mary Parker ,"Partner bed for century certain program. Child bank give leader.
Natural build leave choose difficult set eye behavior. Draw resource attack be.", 1957-03-07 ,Mayotte
969.0, Megan Johnson ," Civil main that practice. Take impact dinner.
Pattern air model. Lawyer give when idea floor provide. Successful customer staff do. ", 1989-10-21 , Liberia 
970.0,  Dwayne Rollins  ," Color choice purpose draw care one road. Nearly institution admit piece.
Including ahead officer owner hospital remain member. Report upon more respond. Catch there finish. ", 1954-05-02 , Armenia 
971.0,Kimberly Allen,"Phone seat natural attention around. Accept anything rock dog sometimes rock million.
Fear rest store sport. Never play they on now floor health him.
Popular strategy program. Recent down take air.", 1951-07-30 , Argentina 
972.0,,"Community computer international center then.
Effect lose me. Various never throw consumer pull. Little parent food management. Recent dog approach exist.",1996-07-30, Estonia 
973.0, Amber May ," Source summer senior side. Lay responsibility spring response eat lose exist.
Member compare artist foot. Performance remain interest finish especially. Brother suddenly skin. ", 1992-12-25 ,Brazil
974.0,Carlos Miles," Sign moment range. House father phone avoid assume. Service college attack education market exactly.
Level increase necessary. Consumer hair adult answer outside food. Respond structure world use. ", 1977-12-26 ,Chile
975.0,   Alicia Robertson   ,"Social man first for hand sure either. Contain hard woman economy.
Paper church nor treat the loss rise. Again end hold property. Huge media recognize claim war heart.",1977-07-20,
976.0,  Timothy Ramirez DVM  ," Part develop hear radio. Prevent prove care throughout believe though easy.
Audience pattern everybody exist skin stay. Threat can example accept. ",1959-09-22,
977.0,  Christopher Jones  ,"What about finish film movie.
Per need support case happy evening yes team. Be hair first couple write or. By skill turn something. Girl social strong find reason consider politics.", 1999-04-06 , Costa Rica 
978.0,  Phillip Johnson  ,Final phone increase. Debate above guess television. Purpose eye subject cost any word. All lead site table professor could him street., 1991-02-08 ,
979.0, Sandra Caldwell , Feeling eight argue significant again single. Agreement realize miss turn. May house husband moment somebody head. ,1997-08-30,Comoros
980.0,  Jacob Baldwin  ,"Lot garden section carry event challenge. People go give data its lot nearly. Way indeed cup sit success officer.
Pull mission rich fine. Century camera happy. President fall feel.",1968-10-24, Mayotte 
981.0,   Mario Moyer   ,Security before show focus set policy picture case. Man choice adult top least. Stop dog if structure difference certain personal seem., 1967-11-04 , Cuba 
982.0, Zachary Bennett ,"While party reach culture realize. Use test short skill. Like treat speak where weight prove impact.
Watch until full series.", 1951-05-29 , Angola 
983.0,  Dennis Clements  ,"Century three industry leader black. Simple stock water rise up newspaper. Down catch fire mention challenge.
Let short expect firm democratic article. Rest vote medical while.", 1994-05-25 ,
984.0,   Mark Ellis   ,Sit main realize effort result those. Culture nature team become. Her unit fear article program answer rock.,1991-04-29,Gabon
985.0,  Shawn Solomon  ,,1959-01-19, Antarctica (the territory South of 60 deg S) 
986.0,, South same recently those hospital opportunity fact end. Do near like middle start within. Fast trial something great forward billion. , 1945-01-07 , Israel 
987.0,  Michael Nunez  ,"Care individual recently she realize somebody commercial from. Body thank cost film size. Place work check several.
Mouth offer rise beyond strategy high firm. Recent road determine.", 1966-07-12 ,Iraq
988.0,  Bradley Miller  ,Modern what benefit first lead notice soon. Become dog science source common difficult billion. Article cold design she small military office., 1944-07-22 ,
989.0,Kevin Hill,"State only one provide. Product friend catch chance.
Shake bank example about allow detail. Inside without cold everybody. Board out break trip chair single kitchen shoulder.", 1985-06-22 , Saint Helena 
990.0,Matthew Young," Because against old move often claim. Investment his Congress.
Outside person red painting happen. Maybe feeling range occur affect radio type. ",1984-01-28,
991.0, Dr. Justin Gill MD ," Step rather something. Reflect economy decade direction whose trial amount individual. Fact history management while than those. Card former share.
Others charge few top speech ever act. ", 1984-03-14 ,Tanzania
992.0,," Possible foreign either color high floor learn. Change nothing similar decide.
Keep probably able enjoy six. Few loss appear blood glass throw. ", 1993-08-11 ,Macedonia
993.0,Jonathan Fernandez,"Meeting more include increase certain.
School maybe while someone hotel. Everything if cold up here since.",1993-10-23,
994.0,   James Sweeney   ,South democratic ever run. Their hour generation commercial open best education. Career expect green., 1955-12-01 ,Lao People's Democratic Republic
,Lisa Hobbs,"Change general here feeling century. Treat win television along talk. Article middle born serious meet.
Late edge level.", 1976-07-05 ,
996.0,," Religious fight radio. Cost realize organization still early.
Stock but Republican enough party quality. Group so clearly entire level.
Against force investment can. Series believe middle in place. ", 1947-09-01 , Armenia 
,  Renee Rivera  ,, 1981-09-10 , Finland 
998.0, Elaine Zimmerman ,Successful skin present seat present half. Trial push here popular left product without.,1950-02-15, United States Virgin Islands 
999.0,Stanley Green,"Traditional show oil able more parent point. Military exactly threat participant.
Same couple reason family form full step. Room party new word admit red instead sign.", 1987-11-29 ,Guadeloupe
1000.0,   Amber Allen   ,,,
,Bonnie Adams,"Ok crime design. Energy a though produce.
Sing spend shoulder letter room special improve. Management cup star painting serious relate.",1948-08-09,Cyprus
774.0,  Renee Schmidt  ," Together message him air cup enter. Happy lay century edge if hear.
Rock fine reach stuff cup what town. Within price budget approach. May true economic weight dinner enjoy. ", 1968-03-24 ,Burkina Faso
, Jordan Price ,"Book wall fight for.
Local majority democratic manager condition. Right important social girl partner. Court their standard event whose child visit.", 1945-12-30 ,Andorra
483.0, Rebecca Young ,Social industry Democrat yeah. Give avoid represent then.,1976-11-09, United Kingdom 
1.0,Ian Henderson,"Some two I consider. Cold part school television. Success skill owner common.
Foot tell them spring difference full. Real organization modern size. Pick kind interest rest detail carry.",1984-03-22,
761.0,  Elizabeth Pearson  , Blue environment nation hundred stand. They require hour will guy dinner stand task. Defense trip network election activity after. ,1961-06-01,
23.0, Molly Ray ,"Heart or near lawyer. Sell own experience gun PM adult use.
Turn interesting court entire. Skill issue gas someone choose work view finish.",1957-03-28,Sri Lanka
