authorID,name,biography,birthdate,nationality
293.0, David Robinson , Check activity suggest season occur student western staff. Source than figure long kind property white. West old like and. ,1968-02-13, Algeria 
294.0, Eric Garcia ," Treatment girl maintain social anything culture. Wrong across away quickly wonder read.
Side policy treatment crime phone. Hair popular national world eat. Entire life mouth half recent so into. ",1966-04-30,Iceland
295.0, Joy Burke , Same step use close operation ago news citizen. Safe much reality a into clear share. Hotel alone left specific. North piece remain peace. , 1995-01-17 ,Cape Verde
296.0,  Judith Duran  ,"Agent short prove chance always walk ask. Two feel only near soldier consumer weight. Movement point property inside.
Trial hand start drive on. Foreign kind white. Staff pass thought daughter.",1948-01-09, Tajikistan 
297.0,  Bill Marsh  , Last live how wide past science. If hand ground music Democrat born. , 1950-09-07 ,
298.0,Sarah Taylor," Them feeling career nothing. Approach keep music design down save whether.
Get party son all listen possible operation left. Recently source but its plan church. Address quickly discover. ", 1968-03-05 ,Martinique
299.0,  Christopher Davis  , None apply worker green. Keep police region look environmental fight. Several month blood according lose sing build. ,,Sri Lanka
300.0,  Richard Craig  ,Late no seven be if often establish sense. Actually must when purpose. Exactly despite teacher big number radio., 1981-01-12 ,American Samoa
301.0,   Darryl Dunn   ," First grow others inside measure budget. My east create conference rather look hundred. Have discussion into.
Stay these evidence third sense. Kid herself right. Tough finally hit. ", 1983-12-07 , Pitcairn Islands 
302.0, Emily White ,"Sea commercial sure group. Position husband about agent heart. But reach walk manager.
Degree tonight camera modern throw statement yes. Site season step member. Participant let event present.",1970-04-29,Macedonia
303.0, Harold Jackson ,"So mouth gun message. Capital study alone pattern nice. Traditional end eight property southern human blood.
Campaign nice city share visit. Culture employee health sort make science accept.", 1999-05-06 ,
304.0,   Kenneth Sharp   ,"Free country behind story. While situation air control each fall.
Scientist may resource could certainly citizen believe hospital. Performance fight together born.", 1947-03-14 ,Singapore
305.0,,Change girl billion tax. Agreement evidence continue animal unit box. Teacher meeting own ago. Production account discussion such color.,1993-01-30, Ghana 
306.0, Crystal Alvarado ,"Before set religious game feeling. Name baby point exactly test yes.
Source here detail nothing thought.
Should either by sign.", 1978-02-13 ,
307.0, Jennifer Tucker ,"Different important draw tax speak later. Country company identify. Study realize car.
Partner work bad new none office. Only maintain evening cut. Again brother section.",1948-06-25,French Polynesia
308.0,  Kimberly Morris  ,"Choice military next there. Ability we big need purpose alone.
Standard cost now until.
Family reveal ok look. Investment into result bad development.",1999-04-21,Syrian Arab Republic
309.0,  Wendy Esparza  ," Often minute moment food. Build indicate page ten. Society rate form then.
Her college here maybe. Color list reflect clear church recognize recently. Husband sort full anyone candidate. ",1981-06-09,Unknown
310.0,   Adam Michael   ," Story to bit us political. Team room also matter must join. Everybody happen act.
Consider again leader reason research drop. ", 1944-07-14 ,Saint Lucia
311.0,  Faith Bender  ," Manager listen he interview. Subject direction clear air television technology open help.
Stock about customer end.
Media region collection participant. Democratic suddenly through. ",, Bosnia and Herzegovina 
312.0, Vanessa James ," Hand relationship article drive positive. By according history ground commercial.
Rock near professional also wide mouth weight. Fall your camera new draw end. American behind help year old know. ",1955-08-24, Hungary 
313.0,   Megan Gill   ," Fire major expert success energy. Move list call whose fight. Include include purpose recent responsibility.
Once condition car song whom. ",1973-08-03,Tunisia
314.0,  Charles Washington  ,,1989-10-21,Malta
315.0,Michael Green Jr., Pick bring main like represent star discuss. Region also civil because far hold. Share third price option individual. , 1947-07-12 ,Iran
316.0,   Nicholas Walker   , Four answer organization there. Fact fall exist section next along computer. Serious important third lot black. ,1952-09-10, Argentina 
317.0, Natalie Johnson ,"Still lead try. Happy more door form face kind dark.
Never head can meeting. Song structure certainly late.
Hit development decide less bad recently. Stop his national. Heavy direction sometimes.", 1971-03-09 ,Saint Helena
318.0,  Cody Garcia  ," Between fill eat. Bed might picture nearly sense.
Notice campaign store recognize throw result whatever. Shake over up ever support left miss. Cell health decade usually experience. ", 1956-03-11 ,
319.0,  Phillip Zimmerman  ,List major most matter raise let article agree. Alone establish consumer help discussion try data half. Party grow carry create.,1946-10-14, Colombia 
320.0,Kristina Johnson," Cold require find forget control almost. Face gas young tough. Loss college the style.
Wall cut campaign return it find. Item federal player trial enjoy especially. ", 1967-10-28 , Unknown 
321.0,Kimberly Miller,Who offer of administration yourself thank listen. Field ball police. Possible head market exactly provide adult data., 1974-12-03 ,Congo
322.0,   Isabel Ross   ," Performance more shake rule Congress body. Read camera spend maybe half company drug. Card already series practice.
Behind somebody entire. Economic hotel seven interest. ", 1977-06-06 ,France
323.0,  Charles Pierce  , With interview will election fly quite. Policy detail perhaps popular will. Read example wall decision game. , 1964-01-31 ,
324.0,  Kevin Wong  , Another son according prevent far maybe owner. Any whole it himself three carry. Society forget me. ,1982-11-30, Unknown 
325.0,   Jessica Foster   ,,1980-03-04,
,  Harold Davis  ,"Without I building every meet wear. Part traditional environment drive type simply. Now huge store.
Minute southern moment exist.",1987-06-14,
327.0,  Stephanie Craig  ,"Or notice under pattern speech. Worry enter raise space. Eat return business lawyer computer enough.
Available decide prepare I his dog art. Since painting leave way thing ground.", 1962-12-18 ,Burundi
328.0,  Clayton Burke  ,, 1974-01-17 , Azerbaijan 
329.0, Steven Page ,"Ever whether person look say effect. Answer peace another. Contain little enough painting various today director.
Loss only debate design surface lead animal. Information nearly country certainly.",1948-10-24, Saudi Arabia 
330.0,   Fernando Jenkins   ,"Church hundred suddenly. Physical that imagine away source.
Seek occur study difference. Eat former another involve someone real woman.", 1960-08-15 ,Bermuda
331.0,   Jordan Thompson   ," Mr fund former full. Dog difficult who economic size everyone. Herself tell majority finish.
Dog yeah family. ", 1971-09-21 ,Latvia
332.0,,"Agreement eight economy identify. Large how may there happy seven. Camera coach now that.
Really condition well myself experience. Tend dream economic six. Cut order single water.", 1980-07-31 , Monaco 
333.0,Jason Garcia, Theory discuss through serious. Explain main direction imagine doctor ahead they. Condition machine interest suffer visit population money. Within within need list chair study the. , 1988-02-18 ,
334.0,Chelsea Watts,, 1963-08-01 ,Bolivia
335.0,  Stuart Mcintyre  ,"Some book interest give listen. Safe scientist growth kitchen PM. Model game collection hotel red.
Catch money most necessary range sell property.",1993-02-19,Unknown
336.0,  Katherine Russo  ,"Top like after growth. Seem prevent up hotel wall. Assume maintain environment make situation part foreign find.
Anyone back book serious knowledge. Hold similar shake together.", 1997-01-21 ,Argentina
337.0,Adam Roberts," Life defense any first cell different center. Hold true gas card meeting around.
Create situation project full whatever note. Close various usually political mention rich yourself. ", 1992-02-18 ,
338.0,Julie Chapman," Nearly lead avoid measure partner third success. Employee board resource stuff.
Stage learn floor. Here law positive phone election film process. ",,Unknown
339.0, Stephanie Richardson ,Former away president politics. Important if tonight by white industry. News recognize close into go recent.,1984-12-07, Brazil 
340.0,  Amy Kirk  ,Here plant another enter city change century. Art month travel audience natural surface body organization. Somebody red music he sort doctor have note. Western school decide whole box mother project.,1972-05-13,Micronesia
341.0,John Riley,Life four institution society lot actually voice. Personal must claim out training price step. Public answer public special.,,Slovakia (Slovak Republic)
342.0,  Matthew Acosta  ,Positive herself the new ground design sure cell. Everything Mrs important fight rock score. Seat soon reflect age measure respond him could.,1975-07-08, Kiribati 
343.0, Elizabeth Goodwin ,"Candidate step let address teach. Land who charge herself again.
Right clear reveal most risk watch. Social hold occur. Improve then defense listen dark industry total in.", 1989-11-30 ,Cyprus
344.0,, Rate threat fill investment. Around trouble affect when beyond. Describe particular choose wife huge memory. Drive feeling consumer major bank. ,1943-06-13,Moldova
345.0,Travis Garza," Individual sport debate treat explain. Trade direction so respond why that year. Seat care step nor.
Boy various shoulder back data. Some they baby common key like performance. ",1969-10-05, Ireland 
,," Develop day amount they let determine music. Down wait government.
If middle attention word. Item movement player western them discover attack one. ",1987-11-26,
347.0,  Kenneth Hudson  , Along provide sound conference discover recent factor. Account enough side consider seven lay serve use. Onto take choice say kind. , 1978-03-11 , Mozambique 
,   Phillip Lynn   ,General someone by. Enter hospital bit cover hand though. Above middle painting reflect reflect ground lead., 1994-12-11 ,
349.0,   Deanna Evans   ,,, Malawi 
350.0, Christopher Hansen ,Little another station decade resource south draw. Deal light star its brother. Popular on board., 1974-01-16 ,
351.0, Mrs. Elizabeth Gallagher ," Mind film truth must. Save cost these common doctor half himself. Any should again put.
Trial when remain opportunity check budget could. Item here staff student ready. Determine skill firm such. ",1987-11-17,Angola
352.0, Tyler Houston ," Trip old herself seek might. Foreign green add.
Into leave guess four education. Finish at development others. ",1959-09-19, French Guiana 
353.0, Vanessa Ruiz ,"Arrive difference situation.
Middle candidate important box. Like voice anything customer Republican protect. Research during security town necessary.", 1952-08-27 ,Vanuatu
354.0,   April Jones   ,"Take perform peace institution child rather. Rich maybe west American rule. Understand call argue according.
Country paper range out culture step fact sense.",1986-01-26, Unknown 
355.0, Tyler Vega ,Order analysis skill family politics product. Whatever cause even. Camera class office leader production.,1951-07-08,
356.0,  Denise Myers  ,"Parent guess here while send. Talk country involve although speak statement.
Since make measure people social according loss. Explain audience series beat.", 1983-08-08 ,
357.0, James Horton ,,1946-03-08, Russian Federation 
358.0,   Lori Holder   , Business back we friend green film. Method painting community dinner else here. Kitchen car before sound along. ,1998-01-30,Poland
359.0, Matthew Russo ,"Simply half station us hour join.
Know level statement player try hair. Wish spring rich education.
Dream meet mother despite. Suffer message play defense sing.",1990-09-18,Unknown
360.0, John Jones ," Expect produce act plant.
Herself level might bit born go forget. Stuff bill yourself think forward girl able nor. Full somebody born campaign. ", 1986-02-13 , Central African Republic 
361.0,  Sara Russell  ,Great position laugh summer product. Child another decade TV black. Throw material professor control., 1977-05-29 , Reunion 
362.0,, Husband onto hour father morning. Authority exactly pretty hair behavior try record foot. Modern win response mother effect. ,1949-11-25,Andorra
363.0,   Joseph Cook   ,Quality to us understand decision your quite. Glass tax reduce fly boy. Treat left live present enjoy fill network relationship. Fast hot say spend money.,,Reunion
364.0,  Stephanie Jackson  ,"Consider letter your industry. Similar hold relationship which receive it bill. Wish finish night general.
Range large another there become single. Order anything out per threat.",1977-03-29,Bhutan
365.0, Angela Shaw ," Many stand room. Whom ok understand read need occur like.
Pretty side third rather set. Reason live key sort.
Region strong result kitchen lead. Trouble else difference. ",1960-04-15,South Georgia and the South Sandwich Islands
,Katherine Lewis,Quality care class also control. Trouble loss teacher information view create business. Letter building recent several mention agree life live., 1979-08-04 , Oman 
367.0,  Dr. Bruce Peterson  ,"Economy history anyone receive billion. Charge not old when daughter support stuff.
Onto its include. Wrong image available anyone.
Student keep why never remain. Send whatever common however.",1978-05-18,Holy See (Vatican City State)
368.0,   Steven Pratt   , Question happen material investment. Which firm pretty finally be security my. Energy whom officer letter security before. Water ability into enter young prepare north sense. , 1997-12-09 ,Austria
369.0,Carlos Richardson,"Hotel provide tax the culture. Really baby so break long.
Candidate hold project black machine. Man manage watch address.
Morning in north. Care television partner reach sister add shake.", 1952-03-21 ,Algeria
,John Torres,Case cultural now religious president wide. Himself hundred grow rise gun PM traditional. Mother moment sport certainly., 1943-09-19 ,Central African Republic
371.0,  Danielle Bailey  ,"Police base indeed officer. Organization argue value report language him sound.
Enter cup blue yet growth figure human man. Happen organization can husband.", 1997-05-31 ,Madagascar
372.0,   Jason Brown   , Fall consumer enter cut. History material talk sign power environment address. ,1975-12-31,Tuvalu
373.0,Pamela Robinson,"Picture own well itself general.
Mean nice ok result contain here. Choice its Democrat family head nearly much. Myself right Congress front buy challenge discussion rate.", 1995-03-19 , Unknown 
374.0,  Brian Jackson  , Term team herself another charge magazine. Carry event her soon great. Direction pull girl rate. ,, Comoros 
375.0,   Kelly Bauer   ,, 1943-11-17 , New Caledonia 
376.0,Lisa Garcia," Week word yard much word. Clearly according industry others sometimes summer.
Indeed deal outside child exist politics. Pay attorney even clearly sign attorney send. Alone enough happen program. ", 1981-04-14 , Cuba 
, Erica Berger ," Degree fight because risk bank example.
Seem while offer family product more. Them bad focus true mouth effect black commercial. Watch control say player break. ",1998-05-16, Saint Barthelemy 
378.0,  Jeffrey Byrd  ," Central everybody skill affect land his perhaps. Pull painting exist rise nor bad.
Young thing response. Change young power drive film easy ahead remain. Late film want speech film candidate. ",1944-10-03,Unknown
379.0,  Maurice Garner  ,"Audience party public factor. Floor lay hospital dream why up follow.
Just usually east field PM Democrat decide. Road must specific statement recent charge voice.",1977-03-03,British Indian Ocean Territory (Chagos Archipelago)
380.0, James Alvarado ,Test couple them similar television. Though cost especially player true drive walk. Expert improve suddenly bit.,1964-03-11, Ecuador 
381.0,  Linda West  ,Case fine sea become. Treatment receive service note agreement door big. Soon name ten agent return whether song., 1975-06-29 ,Bahamas
,Matthew Wright," Choice force term these reflect. Family lot piece movement list. Game employee what.
Financial well buy hair traditional condition. Player beat radio team. ", 1964-05-18 ,
383.0,   Abigail Moore   ,"Coach keep order summer. Speech weight set according carry. Week exactly any and police question pull.
Economy easy small already someone. Doctor effect computer beat vote city around.",1977-09-03, Romania 
384.0, Mrs. Tammy Lee ," Town particularly war top. Design tax alone state whom. Discover care language again east shoulder. Spring few use movie pretty former from.
Seven her student interesting. ",1977-09-27,Dominica
385.0, Jeffrey Greene ," Show race theory trip. Decision painting allow feeling pull reveal.
Oil probably effort street his quite. New hotel within door want baby bar. Instead whom black. ",1955-05-27, Montenegro 
386.0,Pamela Dunn," Hour teacher though soldier change become. Specific mean offer design color man argue.
Bank best teacher blue big attorney. Wife community method head small. Production attorney week impact thus. ", 1961-05-20 ,Congo
387.0,   Nathan Taylor   ,Last majority news pressure fall imagine address. Candidate agency make father. Report fire accept town resource note sound., 1973-08-15 ,South Africa
388.0,  Matthew Turner  ,"Seem law actually. Ten evening charge skill.
Buy as far almost his minute. Move Republican hard color mention off. Artist apply new view write.",1965-10-07,Sweden
389.0,  Blake Williams  ,"To fly unit son. Want information early financial blood. Happen well green simply when.
Research region sort include. Remember prepare almost you song.",1998-07-01,Japan
390.0, Timothy Stanton ,Avoid floor four money. Serious as surface environment better car., 1959-11-25 ,Malaysia
391.0, Kristen Leach ,"Place career keep support nothing yeah price. Issue recognize market dinner feeling wife. Form understand upon well.
Maybe peace nature officer. A past agree.", 1958-05-28 ,Zambia
392.0,  Ashley Perry  , Sit away every cold whatever. Bit happen change weight feel next over. Under woman score trip trouble stuff page must. ,1965-02-12, Eritrea 
393.0, Shawn Melendez ,"Strong later agency white which. Real either perform.
Serve word mouth structure occur. Trip health direction Mr small world people. Participant beat white tough per our center.",1951-09-15,
394.0, Steven Lyons ,"Majority everything inside nearly loss. Cup ahead pretty remember.
Design citizen church and. While area north meeting.",1994-02-24, Malawi 
395.0,   Linda Thompson   , Financial set before establish young. Speak see certain prove manage rule start. General ability environment subject manager keep here. , 1987-01-18 ,Malaysia
396.0,   Taylor Taylor   , Good kitchen serious street medical response. Job senior tell hospital opportunity fall detail during. ,1953-05-02, Lebanon 
397.0,, Short tree personal country film close who. Second around whole international itself political two. ,, Gibraltar 
,James Gallegos, Poor after vote air bad. Nearly if from represent huge. Inside leader they change enough thought though. ,1958-06-29,Kenya
399.0,Sean Stewart,Skill collection hold green everything worry. For like partner eight Congress expect. Large us each time exist weight human.,, Saint Barthelemy 
400.0,  Sarah Norton  ,Candidate game table fast economy government should senior. System future listen anyone exist player. Skill through baby arm language hard man., 1944-12-06 , Turks and Caicos Islands 
,Amanda Williams,"Third couple question. Senior hot conference myself door short. Artist shoulder politics appear.
Very set read. Adult ability exist among question.",1976-06-23,Angola
402.0,  Dr. Gregory Smith Jr.  ,"Gun positive but still various heart pattern television. Above happen necessary ready quickly. Front professional environment next unit.
Bar first risk. Idea anything amount interesting baby.",1970-05-19,Cameroon
403.0,   Connor Davis   ," Where of reflect prepare different cup system.
Term measure goal any yourself. Increase world social same recognize thus although. Town capital class order realize. ",1989-10-20,
404.0,  Larry Stewart  ," Red perhaps anyone include prove.
College nature commercial give run. Modern focus just live about world Mr clearly. Enough long law table. ", 1970-01-05 ,Japan
405.0,  Alexander Hall  ,Democratic time give air. Rise manager newspaper wrong foot not. Check himself forward reduce compare west without.,1981-05-06, Guinea 
406.0,  Dr. April Nichols DVM  ,"Camera either cell address. Item air scientist season direction.
Him social drug most light respond military. Mouth whom thousand special kitchen garden site fact.",1989-08-19, Reunion 
,   Erica Nguyen   , Or military that can race wonder camera along. Others through model parent difference head leave. Class those experience choice past. ,1962-07-08, Somalia 
408.0,   Brian Flynn   , Amount expert whole long include age true. Community necessary town first. One product room save figure father situation. , 1976-10-26 ,
409.0, Richard Kennedy ,, 1964-06-04 , Singapore 
410.0,  Michelle Patel  ," Speak data window sometimes skin. Will answer film financial possible. Us suggest arm century cut. Anyone against usually worry.
Age mention can. Stage know statement like should. ", 1969-02-27 , Romania 
411.0,  Latasha Carter  ," Bar they attack enjoy plan weight year citizen.
Require check sport soon help. ", 1951-05-06 , Canada 
412.0, Jean Gay ," Entire actually often suggest.
Year meeting often person Democrat. Leg cost the write when door friend card. Become food guy than ask least. ",1989-07-01,Guam
413.0,,"Believe new style situation prove.
Discuss positive view color better recent adult. Occur language turn even particularly shake join.",1967-05-19,Cook Islands
414.0,  Harold Davis  ,"Nice front wish reflect. Certain need join plant.
Market can fish inside down race grow wrong. Reveal ability I degree later soon would. Dinner inside black TV.",1996-11-28,
415.0,  Donna Perry  ,"Movement quickly box least establish. Animal toward present east station answer skill song.
Kitchen surface case together. Everything region race less expect tax argue service.", 1952-11-01 ,Botswana
416.0,  Robin Carpenter  ,"Tree toward hand. Assume book radio class institution leg. Care prepare say short over treatment opportunity.
Industry gun dark draw common yes only research.", 1984-01-28 ,
417.0, Danielle Hill ," Moment not work green. Understand region itself third.
Race reduce politics friend. Industry ability than walk Mr market. Reflect without memory myself science lose good dark. ", 1947-10-19 , New Zealand 
418.0, Valerie Miller ," Already who next now. Minute area standard sister human woman by white.
Reflect traditional I. Detail establish indicate board office civil. Add consumer tend everyone result. ", 1976-01-14 ,
419.0,  Timothy Yu  ,Training thought might painting radio phone. Space grow really your mouth suddenly poor. Leave half various agent reduce walk.,, Fiji 
420.0, Marie George ,We yourself teach loss. Have sure study talk. Customer understand rock worry hot meeting different., 1962-10-22 , Philippines 
421.0,   Eric Colon   ," Health treat Republican five recognize thank food. Even west trouble left up old law.
Life general especially sit hand consumer degree. Write sing town. ", 1990-09-24 , Saint Kitts and Nevis 
422.0, David Sanders ," Result edge exactly quality establish. Property garden stop discussion allow. No discussion bring.
Art rate decade hear include several appear from. Arm tough dog owner shake leader economic. ",, Moldova 
423.0,," Authority central myself spend. Issue hot per how. Decision attorney special have building make. Cost system trade book town option.
Trip take structure book none window gun. Real hope month last. ", 1959-07-09 ,
424.0,  Bradley Turner  ," Science ready guy exactly from rich age. Over pattern white be not less. Behind realize prove provide hear. Hold least week character young.
Fill pull protect four leader hear customer. ", 1994-11-28 , United Arab Emirates 
425.0, Nicholas Morris ,Add dark serious almost trade section professional of. Machine shoulder within them discover commercial including. Different heart across tend individual that.,1972-12-14, Jamaica 
426.0, Sean Moore ,"Rock green assume at concern me. Window who your improve morning laugh raise improve.
Improve hot good plant law trade hear. Pm purpose mind expert which.",1960-04-11, Cayman Islands 
427.0,   Erika Archer   ," Tv cell house table east model produce. Phone bed speech top coach.
Would service according effect although require coach here. Create current happen camera. Computer model general time. ",1962-04-28,Norway
,  Nicole Nichols  ," Effect hot successful important trade method. Appear more tend drive early opportunity able.
She good lay agent leader. Play reality serve partner development. ", 1963-05-17 ,Cayman Islands
429.0,  Emily Jones  ,"Pretty develop item mean.
Rise successful plan. Until war environmental foreign door special security.", 1997-11-19 , American Samoa 
430.0, Andrew Hughes ,, 1965-02-17 ,
431.0,  Peter Edwards  ,"Table like then against cover education lay others.
On watch language now involve before own increase. Thing single create. Soon both important surface court memory information.", 1961-02-16 , Aruba 
