authorID,name,biography,birthdate,nationality
575.0,   Brittany Wheeler MD   ," Exactly data whom traditional. Sometimes history yard. Ahead during somebody word arrive.
Just law down relate occur. Market stage information money inside special according. Letter lot wish cost. ", 1945-08-29 ,Mongolia
576.0, Jeffery Young ,"Inside three charge. Score walk single current during loss.
When here option ever us where system. Situation thus operation class. Tough save memory law worry.", 1971-08-29 ,Turks and Caicos Islands
577.0, Christopher Torres ,Effort music a check. Happy option within character respond stand culture. Service shoulder box necessary thus kind bill product., 1949-08-06 ,Yemen
578.0,  Jason Alvarez Jr.  ," Hour likely positive guy quickly others where.
Thousand sea raise guess decade meeting standard. Floor with Congress candidate song. Thought hope federal once save around my. ", 1996-08-31 ,Lebanon
579.0, Sandra Lowe ,About music red create house shoulder. Great message board much say state kitchen. Also wind discover increase seven price.,, Bahrain 
580.0,,"Whole forward purpose view write issue one. Budget need thus office. Various answer standard few seven.
Avoid help like. Writer appear newspaper today.",1971-02-23,Isle of Man
581.0,  Melody Bray  ,,, Unknown 
582.0, Angela Brown ,"Land book condition fund produce beautiful plan. Onto yet character seven.
While century leave resource parent claim. What material allow matter. Budget than clearly already enjoy message visit.",1953-07-27, Guinea 
583.0, Jamie Dougherty , One of as process within. Edge even for son make bring. Party rest enjoy most. Often least customer hospital on. ,1998-09-18,Azerbaijan
584.0,,"Reveal general provide prevent worker program. Degree beautiful minute until unit daughter player then.
Television key performance commercial yeah determine.", 1952-05-02 ,
585.0,   Brenda Warren   ," Few type shoulder eye look. Available behind as government science oil. Election marriage town.
Return nature manager something almost. According land way reach. Event wonder very. ", 1969-03-02 ,Suriname
586.0, Kathy Rodriguez ,,1978-12-05,
587.0, Jillian Sanders ,Son yourself condition wife pick. Wonder standard writer reveal newspaper state value. Current whose practice.,1969-01-31, Tunisia 
, Theresa Knapp , Size visit star near start cut decade crime. Former quickly wind. Always them opportunity easy. Soon treat picture hour carry analysis. ,1958-06-02,Slovenia
, Christopher Chavez ," Myself event according. Blood stop thank magazine image along. Purpose event audience myself.
Always often heart sell focus itself yourself. ",1956-03-20, Andorra 
590.0,Stephanie Thomas, Discuss car anything be sometimes early relationship value. Director subject color change experience agent out. ,1971-10-17,Bulgaria
591.0, David Beasley , Vote find beautiful because however until citizen. Old couple see product mouth prevent friend yard. , 1968-09-08 ,Sudan
592.0, Jeffrey Rodriguez ,Person property your ahead pick. Subject paper certain next view oil he. Get someone Democrat person truth anyone street.,1957-02-09, Saint Kitts and Nevis 
593.0, Sarah Lewis ," Citizen billion oil free all me.
Expect perform write cost. Method student when itself who. ",1964-03-12,
594.0,  Patricia Howe  ,Stuff color side station. Catch beautiful different financial everyone left. Next often student from. Win field spend resource audience always animal., 1956-08-14 , Greenland 
595.0,  John Fowler  ," Actually upon develop population property. Take woman memory.
Mouth example nature sure. Among he where above federal walk. Cost officer bad have away. ",1968-05-14,
596.0, Joseph Ramos ," Standard often according us book. Probably despite majority learn health.
While school minute pressure. Body war realize wrong machine power management pattern. Exist treat shake class. ",,Montserrat
597.0,   Catherine Dennis   ,Give thank door whom environmental. Either hospital plant strong success.,1987-02-15, Malaysia 
598.0,  Bonnie Bowen  ,Radio which bag result especially yeah strong. Himself international cold deep. Republican experience current performance., 1971-06-04 , Tanzania 
599.0,  Deborah Horne  ,Century bag goal everything computer. Just road day similar. Whatever suffer far idea age partner continue.,1958-04-02,Holy See (Vatican City State)
600.0,  Jason Smith  ," Opportunity within consider employee history.
Must future shake smile they rather. Read bag notice.
Enjoy source mind nothing happy none. Give like professor. ", 1977-11-02 ,Rwanda
601.0, Jesus Perez ,"Set cover get choose probably their open. Truth class mention mean. My green describe partner.
Medical dream experience PM cost. Lead key event meeting it.",1972-03-11,Mexico
602.0,   Nicholas Carter   ,"Later whatever product front brother run. Professor human lawyer near commercial. Across I firm manage stay.
None true family level station wall conference.", 1959-06-23 , Maldives 
603.0, Brian Flores ," Wish record bit force. Toward skill big.
Ability into society baby interest. Feeling up catch which Mrs analysis. Likely approach provide long. ", 1954-06-18 , Saint Kitts and Nevis 
604.0,," Despite technology modern a edge woman daughter kitchen. State occur improve very per.
Girl true firm despite. Kitchen reality affect practice shoulder kid. Change leave yourself good simple seat. ", 1980-08-24 , Guyana 
605.0, Sarah Henson ,"Capital point herself kitchen doctor political law. Service him eat moment wrong. Use report shoulder executive pick bar race current.
Lose sell where scene shoulder. Laugh future do take give.", 1947-04-28 , Namibia 
606.0,  Henry James  , Marriage like special environment catch general from. Executive space paper bill hour them. Hair room entire reason. ,, Heard Island and McDonald Islands 
607.0,  Lisa Jones  ," Full and rather form.
Blood agency reveal table but right must tax. Actually nature past happy chance everyone. ",1989-02-14, Reunion 
608.0, Roy Petersen ," Certain can every note environmental eat. Very look hand save look computer between.
Bit if majority natural no ago. Can feel fast because reduce read alone. ",1950-12-07, Slovakia (Slovak Republic) 
609.0,  Amanda Ayala  , Maintain line professional probably address everything. Best main participant resource hard knowledge civil. Size one their still popular green cut. , 1985-01-08 ,Solomon Islands
,Victor Lopez, Yourself surface this government campaign. Pay night risk. , 1950-12-18 ,Micronesia
611.0, Matthew Adams ," Book newspaper adult good appear. Morning protect let popular. Couple radio card with daughter.
Turn seem fact design data government organization. ",1979-08-28,Saint Helena
,  Stephanie Myers  ,, 1991-04-26 ,Timor-Leste
613.0, Amanda Stephens ,"At artist father pick this everyone. Learn morning surface interesting.
Help age choice suggest practice write not. Approach parent central occur Democrat. Camera give so walk crime single respond.",1984-12-08, Thailand 
,  Dawn Adams  ," Everything reality common. Until my worry return range reflect. Race near they instead note.
Indeed hold shoulder several soon interest. Population explain win involve. ",1986-11-24, Belgium 
615.0, Sarah Jones ,With player grow bank. Democratic they authority capital hold office without. State success even box report where against behavior., 1955-12-28 ,
616.0, Miss Kimberly Sloan ,, 1967-11-15 , Hong Kong 
617.0,  Sharon Fisher  ,"Start perform worry hotel PM finally. Example network important create.
Court born nothing give small.",1951-01-11,Mauritania
618.0, Charles Cortez ,, 1963-10-06 ,Tanzania
619.0,, Myself positive claim mother situation. Field population require few friend safe. Today face back sing party military without create. , 1980-01-27 ,South Africa
,," With once result region service total statement. Almost kind forget include.
Gas much process story expect American. Sell play control they. Risk speech raise. ",1980-01-04, Heard Island and McDonald Islands 
621.0,  Casey Reynolds  ," Approach road manage speech lead. Middle task need decade stuff.
Discuss least score close attorney world. Financial consumer win yeah cold view civil. ", 1981-11-17 ,
622.0,   Crystal Cox   , Do certain among. Bit response positive any life stay animal individual. Teach by once so together. ,1986-10-30, Barbados 
623.0,,"Network today maybe these sense indeed student. Throw individual product change. Mother move born heart culture. Catch each spring by.
Take film democratic listen seat choice fine consumer.", 1972-09-25 , Ecuador 
624.0, Jeffrey Morris , Never would only assume religious loss address. Meeting such from laugh. In resource wind apply your major. Create onto fall community data early wear method. ,,Grenada
625.0,  Martin Diaz  ,"Finish mission Mrs resource personal check land. Yeah fear create painting central book.
Fight reveal law woman. Physical follow a trip on.",1961-11-28, Malta 
626.0,   Yolanda Burgess   , Few environmental however rise. Talk sell education situation spend talk follow. School bit record to. Sign production and move different. , 1972-06-10 , Unknown 
627.0,  Lee Cook  , Season him structure leave institution. Recently investment serious response clear several cost. , 1996-10-15 ,Montenegro
628.0, Ashley Russell , One these determine around move key option. Process everybody father authority go growth state marriage. Sense message enter program skill follow. , 1950-06-07 ,Seychelles
629.0,Nancy Montgomery, Page leader rise choose morning contain already. Open many term first himself. Consumer type middle usually purpose along. , 1965-04-12 ,Greenland
,Jay Knapp,"Great pass woman place share support. During deep anything think cup.
Everybody man former room agree town. Him work woman study result church need same.
Travel rock continue require.",1962-11-07, Sudan 
631.0,  Alice Walker  ,,1952-06-07,Guatemala
632.0,  Miranda Edwards  ," East participant this almost. Scene among nor detail individual. Term treat here send young crime sit music.
Indeed theory fast community. Thing picture staff partner her. ",, Gabon 
633.0, Rachael Bryant ," Air American east without. Despite leg trip happen arrive.
Sound fear successful. Give who environmental friend research political. ", 1986-06-09 , Tuvalu 
634.0, Sabrina Green ,Specific institution very player know employee. Task Mr instead range watch development number. Society first behind southern wall.,1949-12-17, Bahrain 
, Rebecca Carter ," Moment machine together image. Discover her group unit none bank.
Soldier different seem cup sense all learn. News three yourself speak position occur owner. Contain reflect while evening game law. ",1955-08-26,
636.0,Tyrone Reyes," Best help positive statement ahead on. The instead election.
Imagine myself race majority any.
Amount leg one. Rise standard go stand for. Easy item teacher stand true increase ten. ", 1948-07-23 , Mongolia 
637.0,   Anna Phillips   ," Include company herself run particularly view put. Full operation benefit something.
Argue two stage can. Light break believe beat. Once film themselves nice clearly hear race. ",1953-12-02,Gambia
638.0, Dakota Fuentes ,Opportunity direction fight government scene. Television could reflect adult improve read everybody. Century much goal matter across carry. Owner into food law opportunity all citizen while.,1996-10-18,
639.0,, Performance month evidence fight start. Above early like between. Particularly fact modern want race. ,,Malta
640.0,, Heavy market speak tell hospital education. Turn yeah hot executive improve their floor beautiful. Forward vote school property police relate picture. , 1983-12-03 , Bolivia 
641.0,  Margaret Mccoy  ,Like teach name door dark. Three only per just suffer reason. Pretty effect such green that., 1968-08-10 ,Moldova
642.0,  Allen Ortiz  ," Go once method cultural number. Enter ask everything since improve.
Glass fight sometimes product. Style discover simple successful total know. ", 1959-12-11 , Luxembourg 
643.0,  Claire Hardy  , Continue information themselves social may. Focus child region director consumer mention. North professional down she Democrat may. ,1990-03-14,Germany
644.0, Christopher Lawrence ,"Chair entire career break. Pay body indeed need. Image wish listen.
Huge all wife owner. None all sound practice later.", 1981-01-25 , Oman 
645.0, John Moore ,"Assume bit various couple career past. Discuss Mr change very for trouble step.
Gas class doctor poor local agree. Soldier unit season under thank weight.
Per personal official allow nothing force.",1991-02-19, Taiwan 
646.0, Patricia Zimmerman ,"Tree her tax main also television. Still and success.
First spring least than food. Reduce money house line. He culture question field.", 1990-04-21 ,Burundi
, Stacie Thompson ," Lot fill music yeah well audience. Pressure set plan Mrs through necessary. Environmental society three.
Should either can something avoid. Research station cultural wide apply minute ahead. ", 1957-09-11 ,
648.0, Kevin Rodgers , Ability daughter cut someone marriage cup which. Low watch already fight study. Finish network mind send themselves race. Likely back discuss course trial every. , 1950-02-05 , Congo 
649.0, Sarah Rodgers ,"Chair city next agreement discover.
Degree ability commercial rich standard whose safe. Office standard small wonder a center wrong. Plant move most.",1975-10-08,Monaco
650.0, Joshua Beck ,"Pm economic right central. Like eye help mouth event protect. Everyone today tell environment.
Feeling professor opportunity no. Natural quickly image rich often area.", 1962-11-27 ,Mauritania
651.0,  Nichole Baker  ," Especially change necessary account painting know under. Defense have else place car whole.
Music remember if down. Do do serious best PM eye fire. City detail nearly physical. ",1986-05-27, Brazil 
652.0,  Cody Logan  ,Federal statement land attack. Else recently performance start new. They consider else see daughter policy would smile., 1972-03-05 ,Qatar
653.0,  William Jones  ,Yourself professional else. Size tree despite owner which Republican. Federal dog until oil ten.,1946-01-03,
654.0,  Anthony Ray MD  , Money share under guess. According raise laugh scientist call explain join. ,1958-06-10, Chad 
655.0,  Sharon Cohen DVM  ," Rate your environment color work build.
Man front security. Religious develop American parent series daughter. Budget south ability answer system. ",1975-05-21,Yemen
656.0,Christine George," Organization just toward practice program mouth. If plant writer type. Sound view science.
Early bank minute sound choose tend. Avoid season follow become. More leg exactly yes answer west. ", 1961-08-13 ,Saint Lucia
657.0, Samantha Kirby ,"Resource sure minute. Still save until. Many street win factor two.
Individual drop movie his reality person discussion. Sing occur store by lay amount exist drop.",1947-06-13,San Marino
658.0,  Scott Morales  ," Bill citizen current remember stop drive. Beautiful ready level beyond.
Key southern such decade size leader such. Scientist themselves money whom until focus. ",,
659.0,Michael Martin," Including fund task baby very ball beautiful. Plan nice part board indicate around learn.
Agree simple activity power language least us.
Rich visit low exist hospital. Tonight second natural. ", 1996-08-22 , Unknown 
660.0,   Candice Thompson   ," Easy there provide unit power.
Member interesting brother woman. Enjoy worry investment home heart show. Community material range answer degree rock. ", 1966-12-27 ,Mauritius
, Jessica Jacobson , Challenge free key our result. Structure bill environment sense almost. ,1988-12-30,Unknown
662.0, Kimberly Williams ," Thousand might floor tell upon. Fear site whatever seven. Lawyer few hear story.
Defense simple someone learn he. Memory meet suffer simply. Seem sea small drive work site us. ", 1965-04-19 ,
663.0, William Vincent ,Space where difference reflect shoulder run write keep. Health play property human success with put agree.,1973-04-25,Maldives
664.0, Cheryl Brown , Face own southern best research yet. Feel message worker letter financial administration because. Before song respond talk throughout total. Everybody chance cut care three. , 1954-06-14 ,
665.0,  Steven Pham  ,,1958-12-04,
666.0,," Find if back history more. Especially level range too section. Necessary happy military our beyond specific.
Home door question audience easy strong white. ", 1988-09-29 , Solomon Islands 
667.0,   Bryan Schneider   , Key yes west third deal sometimes interest. Hear because yes Republican which send occur. , 1977-03-05 , Palau 
668.0,Jennifer Jackson,"Action either owner pressure. Lay tree bill human Congress brother class successful.
Several summer source win. Understand interest debate. Responsibility trial rate lead.",1995-10-23,Rwanda
669.0, Christopher Wallace ,Success tough wait cost reach. Few receive apply cut doctor impact anything. Outside open me thank camera., 1978-08-20 ,Belgium
, Randall Mercer ,"Few news let herself some democratic offer. Born tough security along.
Away late office event. Arm whether peace single cultural may. Once will degree before out customer away.", 1962-07-19 ,
671.0,,"Drop but only call myself world account. Risk wide career subject job.
Score left sit top last. Throughout issue by war election.",, Ukraine 
672.0, Amanda Bell ,, 1969-10-20 ,Libyan Arab Jamahiriya
673.0, Karen Bailey ,Large letter according whatever ten. Build garden possible again next here get. Hair attention never television network., 1955-06-11 ,Unknown
674.0, Thomas Santos , Available hard read military nation forward sort respond. Hard character college exactly instead dog produce. ,1973-07-19,Reunion
, Nicholas Johnson ,Force sound travel tax big agency. Glass close white seat price adult wall thank. Management weight room ago light shoulder sit pattern.,1991-10-22,
676.0,  James Hart  ," Order start do common clear. Support all next pattern history lay performance final.
Too religious lay firm. Term effort child turn hotel must both. Good visit factor bed at seven before executive. ",1947-04-20,
677.0, Courtney Bowman , Onto in capital own tell worry. State analysis against Republican participant we. Minute accept special health. ,1953-10-01, Ghana 
,Cody Wolfe,Population vote different have early think. Buy science data and black have. Trial country much lay argue weight., 1964-10-09 ,
679.0, Thomas Ward ,"Involve president open appear to. Ability all information first trip able very.
Pull performance far type sea far. Grow this seem let professor population.", 1944-12-15 ,Heard Island and McDonald Islands
680.0,   Mark Bush   ,"Stock bag card answer series. Building economy able office stock say.
Place cold race lead personal high. Lose nearly home authority event show.",, Estonia 
681.0,  Debbie Kemp  ,Share worker test. Lose watch three answer hear himself majority cold., 1958-10-01 ,Slovenia
682.0,  Tammy Ramsey  ,,1971-11-09,Uganda
683.0,  Dale Frazier  ," Western least seek game. Statement court thought large service now. Nearly American move.
Account about cut civil find set kitchen. Street most through management issue. Fire morning large tell page. ", 1970-05-12 , Italy 
684.0, Mr. Michael Campos ," Sense do or pattern threat drop get. Drug head old get. As mother tough respond writer measure education various.
Better clearly camera create. Left weight standard community ball party. ",, United Arab Emirates 
,  Juan Lam  ,"Turn reveal night item fund. Kind whose performance attack upon operation dinner. Ready bit billion worker continue.
Eight piece eat wide fish itself body affect.",,India
686.0,  Kevin Wallace  ," Mouth back tend it realize American.
Main number mother outside network scientist. Compare task and piece everything bar simply anything. Shake establish suggest off. ",1952-05-04, Martinique 
687.0,   Danielle Evans   , Thought body group data manage enter. Structure mother energy allow remain. , 1992-01-13 ,
688.0,   Valerie Stuart   ,,1979-11-27,Spain
689.0,Jennifer Sanchez,"Explain floor continue note factor decide situation. Be left key amount thing matter. Bed memory environmental take.
Product example become hundred long. Court pick crime across treat.",,Unknown
690.0,  Dalton Jones  ,Relationship eat bill none player indicate. Range vote improve reveal idea how. Group local several level less inside first third.,1999-01-28, Bermuda 
691.0,  Zachary Wood  ,Director particular to state. Beat enjoy sea human success simple strategy network. Window reduce grow price eat sit seem.,1969-06-15, Zimbabwe 
692.0, Charles Johnson ,Eat watch probably door case worry win. On teacher book already experience wish choose. Standard financial score ball example scene claim avoid., 1962-12-16 , Ireland 
, Mary Chang ,"His open drive. Quality she hold.
He fund agree score five. Happen reduce Mr. Case rest dinner family whatever.
Person perform something say. State line reason save product good.",1997-11-08,Sudan
694.0,  Michael Richmond  ," State level bit court maintain. Debate lot room make southern play.
Hospital whose so mouth claim score head. Give thought picture modern assume. ",,Poland
,,"Special bad local stage. Level policy cultural any garden know.
Glass your include investment. Involve community spring. Enter good area beyond school day prevent business.", 1988-11-07 , Tunisia 
696.0,  Jonathan Crane  ," Skill face almost focus. Cost white fire return hope eight four ago.
Own rule popular north image mouth. Others buy nature lot style grow fire. Environment movie experience fine. ",,
697.0,  Daniel Peterson  ,"Marriage such class participant commercial. Late officer too respond pretty teach economic. Condition soon success life beautiful.
Beyond cold free home. Also also goal three month.", 1973-11-30 ,Peru
698.0,Brian Nash," Others score accept car want. Field peace sense young protect do music.
Tend out professional once machine. Officer consumer attorney recognize from white. Name local street address piece. ",,
699.0,,Anything daughter data shoulder change look difficult particular. Hard attention several wait dark level draw. How per wife common language., 1950-10-08 ,Bulgaria
700.0, James Vang Jr. , Short wall evidence each modern surface real. Treat face thing suggest manage worry. Exactly six song easy force attention. , 1969-04-30 ,Sudan
701.0,  Nicole Pham  ,"Feeling rule gas.
After our conference look heart political case relationship. Human drug individual author trip up class. Change group red.
Finish if run support that either among.", 1950-08-31 ,Saint Lucia
702.0, Patricia Hammond ," Arm ten reflect wife tree. Sell consumer attention themselves back.
Serious size show out against member Congress most. Civil third worry themselves follow today. ", 1950-10-15 , Italy 
703.0,  Crystal Huerta  ," Course really interesting door thus any. Little network together agree since.
Sport spend stop someone dinner interest Republican. Forget finish arm capital fire sister. ", 1949-10-20 , Afghanistan 
, Robert Martin ,"Factor church build history those.
After remember smile low crime level. Data fact she situation prevent. Sense skin late allow election attack.", 1990-03-07 ,
705.0, Mary Newton ,,1988-09-21, Malaysia 
706.0,,"Law stand art sister.
His under race budget cup increase here. Company product however skin better situation.
Whom book color seven and.",1971-03-06, Maldives 
707.0, Shane Fowler , Language successful improve receive political ago feel. Voice drug may difficult mention we create structure. Choose spend such attention fill. ,1990-11-19, Honduras 
708.0,Mrs. Kathryn Nelson,Finally rule then kind issue. Successful treat guy story agree but. Set bill citizen mind some color understand. Thousand there instead give official.,1980-03-13, Swaziland 
,Willie Francis, Girl at unit charge. Song thus age evidence talk time police along. Anything pull according machine PM. Throw hand become summer. , 1966-07-03 ,Romania
710.0,  Katie Aguilar  ," Create stand able Mr. Picture full challenge.
Usually instead part generation since employee or. Rock follow lot sing concern. Of certainly available door get. ",1992-11-12, Burundi 
711.0, Kiara Poole ," Pay article kind for space staff expect herself. Foot third them still election decade director. Street model soon he.
Across discussion decision president forward. Plan southern local water while. ", 1977-07-23 , China 
712.0,  William Cisneros  ," Indicate see opportunity particular. Necessary market hair effort amount. Wide matter local.
Style who east contain computer worry already. Parent answer international fight. Poor film among spend. ",1962-04-24,Turkey
,   Kenneth Sims   ,"Shoulder minute per few. However likely cause actually only read group. Name room positive.
Important record feeling look central together grow. Boy share newspaper. Ready skill could.",1988-12-16, Malta 
,Jeanette Jacobs," Expert against throughout leave how. Mean up fine star wide industry.
Magazine perhaps save must. Grow stop ever standard. ",1978-05-20, Slovenia 
715.0, Jonathan Caldwell ," Usually entire east director little degree. I dream education film.
Least left tend yeah north.
Both significant and out. Still enjoy so change. Treatment sure over news. ",1963-08-10, Mauritius 
716.0, Katherine Howell , Almost determine left force base southern film. Resource pattern recent summer general already. Something response democratic four. , 1991-08-18 ,Belgium
,Christine Chang," Sort child run.
Reflect detail citizen year treatment. Natural Republican election machine. Image adult bad rest that action.
Leave politics receive audience home. Also game though size just former. ", 1967-08-02 ,Timor-Leste
,   Travis Stone   , Yet production operation maybe almost popular stand. Any manager already. Step skin position plant analysis rock resource. ,,Iran
